{
  "draftStatusWarning": "Unstable pre-0.1 review schema for draft-infantado-agent-memory-architecture-00; candidate interoperability model, not a frozen protocol contract.",
  "event_id": "evt:create:repeat",
  "operation_id": "idem:create:001",
  "scope_id": "workspace:example",
  "object_id": "mem:claim:create",
  "version_id": "ver:claim:create:1",
  "event_type": "object_created",
  "occurred_at": "2026-07-11T00:00:00Z",
  "actor": {
    "actor_id": "actor:editor:001",
    "actor_kind": "human"
  },
  "payload": {
    "idempotency_result": "replayed_original_result"
  }
}
